{
  "id": "status:xphb:concentration",
  "name": "Concentration",
  "sourceMetadata": {
    "source": "XPHB",
    "page": 363,
    "flags": {
      "srd52": true,
      "basicRules2024": true
    }
  },
  "mechanics": [
    {
      "kind": "MAINTENANCE_SAVE",
      "ability": "constitution",
      "trigger": "damage",
      "dc": {
        "formula": "higher-of-base-or-damage-fraction",
        "base": 10,
        "damageFraction": 0.5,
        "rounding": "down",
        "maximum": 30
      },
      "failure": "status-ends"
    },
    {
      "kind": "ENDING_CONDITION",
      "when": "another-concentration-effect-starts",
      "automatic": true
    },
    {
      "kind": "ENDING_CONDITION",
      "when": "incapacitated",
      "automatic": true
    },
    {
      "kind": "ENDING_CONDITION",
      "when": "dies",
      "automatic": true
    },
    {
      "kind": "ENDING_CONDITION",
      "when": "voluntarily",
      "automatic": false,
      "actionRequired": false
    }
  ]
}
